Character,Gender,Line
Jill,Female,"Synthesis? I have to make it myself? Alright, gotta figure this out."
Computer,,Override key successfully generated.
Jill,Female,What have we here?
Computer,,Override key removed.
Computer,,Override complete.
Jill,Female,An antigen sample. I'll definitely need this for the vaccine.
Jill,Female,This must be what powers it.
Jill,Female,Out of the way!
Jill,Female,So it's called the Nemesis.
Computer,,Synthesizing vaccine... Synthesis complete. Please remove the vaccine canister.
Jill,Female,What in god's name is this place?
Nicholai,Male,Ooh. What do we have here?
Jill,Female,"Nicholai, don't! The city needs that vaccine!"
Nicholai,Male,"More than I do? Hmm. (he steps on Jill’s hand) I don't think the wisdom I've been trying to impart on you is getting through. Now I know you can't put a price on life. But I'm in this business to get paid. So let's make a deal. You go down there, battle the Nemesis. And if record it all and sell the combat data. Put on a good show and maybe I don't need the vaccine. Agreed? Good."
Carlos,Male,"Jill, is that you?"
Jill,Female,Carlos!?
Carlos,Male,You're OK! Let me spot for you!
Jill,Female,Good idea.
Carlos,Male,"Watch it! You've got company! He's hiding behind tank eight! Number eight! Here come some more! Look out! He's hiding behind tank two! Now! Rip that fucker apart! Got some more incoming! Number two! Yeah! Here come some more! Look out! Got some more incoming! Number one! Here come some more! Look out! Got some more incoming! Number five! I got this! Not what I intended to hit, but I'll take it! Here come some more! Look out! Got some more incoming! Number seven! Here come some more! Look out!"
Carlos,Male,Jill! Here comes the crane. Use it to climb up!
Jill,Female,"Oh no! C'mon, c'mon…"
Carlos,Male,"Jill, stay back!"
Carlos,Male,Now! Get on! I'm gonna melt this fucker into mush.
Carlos,Male,"OK, I'll meet you up ahead!"
Jill,Female,Nicholai. Where did you go...? I have to get that vaccine back.
Jill,Female,"It's done. Give me the vaccine, you greedy son of a bitch."
Nicholai,Male,Oh no no no no. You print money. I like money. We shall make ours an ongoing arrangement Now drop the gun!
Nicholai,Male,"Have you—Have you ever seen anything so incredible? The data on this would be worth millions! But, uh, you know how it is—city's about to explode... And you can't put a price on life. Good luck!"
Jill,Female,Nicholai!
Carlos,Male,Jill!
Jill,Female,Go after Nicholai! He's got the vaccine!
Carlos,Male,What about you?
Jill,Female,We're running out of time! I've got this.
Carlos,Male,I know you do.
Jill,Female,"(to Nemesis) Look, Just so you know? This is the last fucking time."
Computer,,Opening compartment.
Jill,Female,Now we're talking!
Computer,,Cooldown in progress. Please reactivate power sources.
Jill,Female,"Damn, it needs power! Felt that, did you? How about some more! Go ahead! I'm gonna put you right back on your ass! You think I don't know how to fuck you up!?"
Computer,,All power sources activated. Powering up.
Jill,Female,I am sick of your SHIT!
Jill,Female,Come on! Next time… take the fucking hint.
Jill,Female,Good riddance.
Jill,Female,Can't let Nicholai get away with that vaccine! I hope Carlos managed to stop him. I can still catch him.
Jill,Female,Oh no…
Nicholai,Male,"You're not going to stop me. Promised you this, didn't I?"
Jill,Female,No! Do you have any idea what you've just done?
Nicholai,Male,Don't know. Don't care. My client ordered me to reduce Umbrella to rubble.
Computer,,Ten minutes until missile impact.
Nicholai,Male,"Ah. The missile has launched. And that is my cue to leave. Good-bye, Miss Valentine. A shame you didn't listen to me when you had the chance."
Carlos,Male,Jill! Shoot him!
Jill,Female,I can't! I'll hit you!
Carlos,Male,Do it! You have to! There's no other way!
Jill,Female,Carlos!
Carlos,Male,Hey. I told you I couldn't leave you in a Carlos-less world. That would just be too cruel. What about him?
Jill,Female,Why'd you do it?
Nicholai,Male,There's a price tag for everything. Even letting the world burn.
Jill,Female,Who are you working for?
Nicholai,Male,I'll tell you if you get me out of here. I'll pay you whatever you want.
Nicholai,Male,"You're a fool. You're a fool! If I die, you'll never find out the truth."
Jill,Female,I don't mind a little detective work.
Carlos,Male,Jill. You alright?
Jill,Female,There it is.
Carlos,Male,It's finally over.
Jill,Female,"So long, RC."
