Character,Gender,Line
Monk,,"Sumergida en el agua purificadora, envuelta en inmaculado y que aquí te ofrecemos. Oh, señor, que la luz de tu gloria la ilumine hacia tu paraíso. Acepta este cordero, muestra tu poder y acógenos en el paraíso, en tu seno inmaculado. ¡Oh, señor!"
Leon,Male,"(offscreen) September 30, 1998… It's a day I'll never forget. The cop inside me died that day. And that night, Raccoon City was wiped out. Thanks to the bioweapons created by Umbrella. Somehow, I made it out. But too many others...weren't so lucky. I was asked later to join a top-secret government program. Not that I had a choice. The training, the punishing missions nearly killed me. But at least they kept my mind off everything. If I could just forget what happened that night, the pain—even for a second. This time, it can be different. It has to."
Old Policeman,,"So, tell me, Yanqui (Yankee)… why did you come to this horrible place? As close to nowhere that I've ever seen? (laughs)"
Leon,Male,Let's just say—looking for someone.
Old Policeman,,"That someone must be very important, eh? The chief gave the orders himself. Help him, he said."
Leon,Male,"Well, I'm sure you boys didn't come all the way out here to roast marshmallows. (Old Policeman laughs) ...Or maybe you did."
Old Policeman,,You have a strange sense of humor. I'm gonna let you in on a little secret. Just between us. A lot of people have gone missing around here. And it's been that way for a while now.
Leon,Male,"Well, then...should be just another day in the office, right?"
Old Policeman,,"I mean, last week there was a search for some missing hikers. (laughs)"
Leon,Male,I'm sure you'll do your best to help me…
Young Policeman,,I think this is it.
Old Policeman,,"Nature calls, eh? I'll be right back."
Old Policeman,,(In Spanish) Freezing out here.
Young Policeman,,(In Spanish) You drink the whole bar?
Old Policeman,,Tssshhr.
Young Policeman,,You smoke?
Old Policeman,,(In Spanish) This is one hell of a gloomy place.
Old Policeman,,(In Spanish) Hey? Anyone there?
Young Policeman,,He sure is taking his time. Did he fall in? Maybe you better go and take a look?
Young Policeman,,I'll watch the car. Wouldn't want to get a parking ticket.
Leon,Male,So much for helping me.
Leon,Male,How far could he have gone?
Leon,Male,Anyone home?
Leon,Male,"Uh, sorry to barge in like this. (In Spanish) I'm looking for a police officer. Did he come this way?"
Leon,Male,This is not good…
Leon,Male,"Man, that stinks."
Leon,Male,I read you! What's your situation!?
Leon,Male,The hell is going on?
Leon,Male,What was that?
Leon,Male,No fucking way!
Leon,Male,This just keeps getting worse…
Leon,Male,"Roost, this is Condor One."
Hunnigan,Female,Hunnigan here. What's your sitrep?
Leon,Male,The president's daughter—Baby Eagle. It's likely she's in this village.
Hunnigan,Female,"Our intel was correct, then. Well done."
Leon,Male,Need a location on a nearby lake. She may have been taken there.
Hunnigan,Female,Copy that. I'll see what I can find.
Leon,Male,Hurry up. Something's happened to the people here. My escorts are—
Leon,Male,Gotta go. Talk later.
Leon,Male,I'll let myself out!
Leon,Male,Holy shit…
Leon,Male,Here we go.
Leon,Male,You gotta be kidding me.
Leon,Male,It's my lucky day.
Leon,Male,"Oh, nice."
Leon,Male,You're shitting me!
Leon,Male,You've gotta be kidding me!
Leon,Male,"Oh, sorry!"
Leon,Male,Huh?
Leon,Male,Where's everyone going? Bingo?
Hunnigan,Female,Roost to Condor One. I've identified a route to the lake. Look for a large windmill. There's a path on the far side of it.
Leon,Male,Windmill. Copy that.
Hunnigan,Female,And be careful. Roost out.
Leon,Male,These people are sick.
Leon,Male,There it is.
Leon,Male,Gotta fix everything myself.
Leon,Male,God damn.
Leon,Male,Shit!
Leon,Male,This the place?
Leon,Male,What's that noise?
Man,Male,"That hurts, you know?"
Leon,Male,Seemed like you really wanted to talk.
Man,Male,"How observant, señor. Now, say—you got a smoke?"
Leon,Male,"You know, those things will kill you."
Man,Male,"Oh, well, maybe just untie me then?"
Man,Male,¡Joder! (Fuck!) Not this guy.
Leon,Male,"Who are you? OK, stop right there!"
Monk,,Sacrificial lamb. You will receive our most sacred body. It begins now.
Leon,Male,"Oh, what the fuck?"
Man,Male,"Hey, stop it! Oye, Yanqui (Yankee), got a name?"
Leon,Male,Leon.
Man,Male,"Quiet type, eh? I'm Luis Serra. And guess—you, me—picked the wrong spot to vacation, eh?"
Luis,Male,"Hey, stop it! You move, I move... and I'm beat up enough as it is! I can see your thinking. Bet you've been in spots like this before. My guess… you're here looking for someone? One more guess. Maybe... some missing señorita?"
Leon,Male,A young girl?
Leon,Male,Talk. Now.
Luis,Male,"All right. See, I heard chatter about moving a señorita."
Leon,Male,Moving her. Where?
Luis,Male,"Who knows? But later, saw some men dragging someone… to the old church."
Luis,Male,Mierda… Hanging with you? Not healthy—
Leon,Male,"Hey, we're not done here!"
Luis,Male,"Later, amigo!"
Leon,Male,Shit. They took my gear.
Leon,Male,Condor One to Roost. I've located Baby Eagle. It sounds like she's being kept in some church.
Hunnigan,Female,Great! That's good news.
Leon,Male,I heard it from this guy I met. Said his name is Luis Serra. There was something fishy about him. I need you run a background check.
Hunnigan,Female,"Wilco, Condor One. I'll see what I can find. In the meantime, make your way to that church."
Leon,Male,Right. I'm probably due for confession anyway. Condor One out.
Leon,Male,"Hey, that's my gear."
Leon,Male,I'll be taking these back.
Man,Male,"Over here, stranger."
Leon,Male,Who is that?
Merchant,,"Let's do some business then, ey! Welcome! A job well done deserves payment in kind. Got some rare things on sale, stranger. That's good work if I do say so myself. Pleasant travels. What's that? How have we procured these curiosities? Heheheh, you don't wanna know, mate. Rubies or rubbish, it makes no difference. The price, well, that's our choice to make. A deal well struck, heheh! A bit more space never hurt anyone. Perfect size for you, stranger. Wish your enemies sweet dreams from afar with a bullet straight through their heads, mwahaha! Go on, take this as well. Free of charge! All yours, stranger. So that's a request, done and dusted, eh? Good stuff, mate. Haha, well done! You've proven yourself reliable. Well then. What can I do you for? Your valuables won't do you much good in the grave. Got a selection of good things on sale, stranger! A wise choice, mate. Its ammo will penetrate just about anything."
Leon,Male,The hell am I?
Leon,Male,"All right. Outta the way! Sorry, must've slipped. They keep coming!"
Merchant,,"Hello, stranger. We're starting to get an idea of your tastes, friend. Good as new. Anything else I can 'elp you with? Come back anytime."
Leon,Male,"Oh... Break's over, I suppose!"
Leon,Male,"Well, that stinks."
Leon,Male,Fuck!
Leon,Male,Are you even feeling this?
Leon,Male,Finally.
Leon,Male,Not too shabby. Someone is showing up their neighbors.
Leon,Male,Old photos…
Old Man,Male,Your blood has accepted the Gift.
Leon,Male,Gift… in my blood?
Hunnigan,Female,Roost to Condor One. I've got that intel you requested on Luis Serra. It seems he used to be a researcher for Umbrella.
Leon,Male,Umbrella? I should've left him in that bag to rot.
Hunnigan,Female,"I'm sending you the details. Take a look, but Baby Eagle is your priority."
Leon,Male,Copy that. Making my way to the church. Condor One out.
Leon,Male,"You too, huh?"
Leon,Male,"Take care of yourself, buddy."
Leon,Male,What!?
Leon,Male,Next?
Merchant,,"I have some new goods that might interest you. Welcome! Got some rare things on sale, stranger. There's some things money can't buy. You've got a soft spot for treasure, ey? Yeah, that's the way. Got a selection of good things on sale, stranger! I knew you were a go-getter! Why not try your hand at a new gun, stranger? Might save your life… Not only will you need cash but you'll need guts to buy that weapon. Information is a commodity these days. Easy work."
Leon,Male,A church... I made it.
Leon,Male,Damn it.
Leon,Male,Condor One to Roost. The church is sealed up.
Hunnigan,Female,And Baby Eagle?
Leon,Male,"Negative, nothing yet. But they sure do have this place locked up tight."
Hunnigan,Female,I see. I can think of one reason they'd want to do so.
Leon,Male,"Oh she's here, that's for sure. I'll find a way in. Condor One out."
Leon,Male,The lake... Let's hope for no more surprises.
Leon,Male,They keep coming! Outta the way!
Leon,Male,Good luck finding someone big enough to use this thing.
Merchant,,"So that's a request, done and dusted, eh? Good stuff, mate."
Leon,Male,There are enough weapons here to get a party going.
Merchant,,"Good stuff, stranger! What can I interest you in? My back is killin' me. Years haven't been kind to us, I suppose. I'll buy almost anything. Well done, stranger! Got a selection of good things on sale, stranger! Crossin' your T's, dottin' your I's. That's the way to be. This kind of work is about finesse, stranger. Little bit goes a long way. You'll see… A well-tuned weapon can make up for a lack of skill, friend. We're starting to get an idea of your tastes, friend. Come back anytime. Gun rhymes with fun for a reason, stranger!"
Merchant,,"Welcome, stranger. I believe this is your first time 'aving a go at target practice. There's only one rule—shoot the targets as they pop up. Simple enough, am I right? If you do well, I'll make it worth your while. Knick knacks and whatnot. Anyway, have fun, mate! Rely too much on a single weapon and you'll find yourself out of ammo, mate. Begin! Brilliant! That's the stuff! Superb shot! Reload! Brilliant! That's it! It's a bullet bonanza! Fire everything you've got! That's your lot! A perfect performance!? Are you for real, mate!? Begin! Superb shot! You're an artist, mate! Oh, beautiful! Brilliant! Reload! Double kill! You're an artist, mate! And that's the game! My... I-I'm speechless. Begin! That's the stuff! Reload! You're an artist, mate! Double kill! Brilliant! You've been waitin' for it. A flood of targets! You're an artist, mate! Oh, beautiful! And that's the game! Some of the targets are, well, particularly sturdy. One shot won't be enough for those, I'd wager! Do come again, stranger."
Leon,Male,Fuck.
Leon,Male,The hell was that?
Leon,Male,Looks like there's something over there.
Leon,Male,"Damn, look at the size of that..."
Leon,Male,"C'mon, fill the tank when you're done! All right."
Leon,Male,Shit. God damn it.
Leon,Male,Huh!
Leon,Male,One down.
Leon,Male,"Sorry, must've slipped. Last one. This is what I'm talking about. All right. They keep coming!"
Merchant,,"Ah, I see you took care of a request. Well done. Nice work! Well then. What can I do you for? What's that? How have we procured these curiosities? Heheheh, you don't wanna know, mate. Heheh, a wise choice. I know I say that a lot, but I mean it. Rubies or rubbish, it makes no difference. The price, well, that's our choice to make. Perfect. You're a real professional. Easy work. Moldin' a weapon to suit your specific needs, oho! It's a thing of beauty, innit? Dazzled, are you? Our craftsmanship demands no less. Will that be all, then? Can't sell what I don't have. Don't get yourself killed now, haha."
Leon,Male,"Think you can swallow me whole, huh?"
Leon,Male,Where'd you go?
Saddler,Male,"Sacrificial lamb. You will receive our most sacred body. It begins now. When day breaks, you too will join our covenant. To share in my holy blessing… forever."
Leon,Male,Condor One to Roost. Do you read me?
Hunnigan,Female,Condor One!? You've been radio silent for three hours. Are you all right?
Leon,Male,Yeah… I'm fine. Won't let it happen again.
Hunnigan,Female,And the church?
Leon,Male,Still looking for whatever key I need.
Hunnigan,Female,Copy that. I'm glad you're OK. Roost out.
Leon,Male,What the...? What the fuck...
Leon,Male,What is this place? Some kind of shrine? Same mark from the church.
Leon,Male,Is this the key?
Leon,Male,It's the lake.
Merchant,,"I have some new goods that might interest you. Welcome! Got some rare things on sale, stranger. You'll get some bang for your buck, I guarantee it. Information is a commodity these days. Without the necessary funds, I'm afraid we don't have a deal! That won't cover it, I'm afraid. Thank you! Will that be all, then? Don't get yourself killed now, haha. A deal well struck, heheh! A decent size. But size ain't everything, am I right? See how that feels, mate. Fella like yourself should notice the difference right away."
Leon,Male,"Ah, it's locked. All right. Here you go! Give me a break already. You're serious?"
Merchant,,"Nothing but the finest wares! Welcome! What can I interest you in? This is what I'm talking about! Fine work! Without the necessary funds, I'm afraid we don't have a deal! Haha, well done! You've proven yourself reliable. Anything else I can 'elp you with? My back is killin' me. Years haven't been kind to us, I suppose. Heheh, a wise choice. I know I say that a lot, but I mean it. Good as new. There you are, as you wished. This kind of work is about finesse, stranger. Little bit goes a long way. You'll see… Well then. What can I do you for? Pleasant travels."
Leon,Male,Condor One to Roost. I found the key to the church.
Hunnigan,Female,"Copy that. Now, go get Baby Eagle."
Leon,Male,"Right, no time to chat. I'm going in. Condor One out."
Leon,Male,Shit.
Leon,Male,Here you go! Present for you.
Leon,Male,"Hey, it's that dog. You wanna help? Cause I could use it!"
Leon,Male,You got worms too?
Leon,Male,You're kidding me. Shit!
Leon,Male,That's what I'm talking about! Good boy!
Leon,Male,Shit! C'mon!
Leon,Male,"God damn... I was almost a pancake. OK, let's get to that church."
Leon,Male,"Thanks, bud."
Leon,Male,Ashley Graham!? I'm here to help!
Leon,Male,Ashley? You in there?
Leon,Male,"Ashley? Ashley Graham, are you in here?"
Ashley,Female,Just let me go.
Leon,Male,Listen.
Leon,Male,"Easy with that! My name's Leon. I'm here on the president's orders, and—"
Leon,Male,That went well.
Leon,Male,Hey. It's dangerous outside. You need to listen to me—
Ashley,Female,What is that? Over there?
Saddler,Male,Pursue them. The lost lambs are escaping. Deliver unto them... salvation.
Ashley,Female,What do we do?
Leon,Male,"Your father trusts me. And I need you to trust me too, and do exactly as I say. I'm gonna get you home safe."
Ashley,Female,"OK, Leon."
Leon,Male,"All right, let's get the hell out of here."
Ashley,Female,Seriously? I just bought this.
Leon,Male,Get the ladder.
Ashley,Female,"Me? Um, OK."
Ashley,Female,What do we do? There's no way out.
Ashley,Female,No way.
Leon,Male,"It's OK. I've got you. Hey, trust me!"
Ashley,Female,Th-Thanks…
Leon,Male,"Roost, I've secured Baby Eagle."
Hunnigan,Female,Copy that. Is she OK?
Leon,Male,Affirmative.
Hunnigan,Female,"Well done, Condor One. I'll dispatch a chopper ASAP. I'm sending you the coordinates for the extraction point. Make your way there. And don't let anything happen to Baby Eagle."
Leon,Male,Copy that.
Hunnigan,Female,"Hurry, the weather is getting worse. Roost out."
Leon,Male,"Like I said, it's dangerous. Stay close."
Ashley,Female,OK.
Leon,Male,OK. It's all right. With me.
Ashley,Female,OK.
Leon,Male,You're serious? They're coming. Get behind me!
Ashley,Female,"Oh, god! What is wrong with these people!?"
Leon,Male,Give me some space.
Ashley,Female,OK.
Leon,Male,Come on!
Ashley,Female,No prob.
Merchant,,"I have something I think you'll like. Welcome! Oh, what're ya buyin'? A deal well struck, heheh! Come back anytime."
Ashley,Female,"Hey, can we take a break?"
Leon,Male,"Sorry, we need to keep moving."
Ashley,Female,Got it…
Leon,Male,Hunnigan was right about the weather…
Leon,Male,Shit! Come on. I need you to open it from the other side. It's open. Good work. Damn! I knew it. Next?
Ashley,Female,"Seriously, this can't be happening..."
Leon,Male,C'mon! Shit!
Ashley,Female,"Leon, no!"
Leon,Male,Twisty son of a bitch.
Ashley,Female,I'm definitely gonna catch a cold.
Luis,Male,Hey! Over here! Come on!
Leon,Male,You!
Luis,Male,"Hey... Listen, about earlier, I—"
Leon,Male,"Yeah, about that…"
Luis,Male,Hey. I see you found your missing señorita.
Ashley,Female,"The señorita has a name, and it's Ashley. And you are?"
Luis,Male,Name's Luis. Encantado. (Charmed.)
Leon,Male,Great. We all have names. Now then—Who are you? And what're you doing here?
Luis,Male,"Very good questions, unfortunately…"
Leon,Male,Hide. Now!
Luis,Male,"In that case, here, help me."
Leon,Male,"Ashley, quick! Over here! Go!"
Luis,Male,OK. It's game time.
Luis,Male,"Hordes of them against two of us. Oh, and let's not forget—this mob is made up of monsters. You done warming up? Hope you stretched!"
Leon,Male,"Yeah. Now, if you'd shut up, we'd be good to go."
Luis,Male,"Lighten up, cowboy."
Leon,Male,Give me a break already.
Luis,Male,"I've been waiting, hero boy! Perfect timing! Give me a hand! One down. It's all you! They keep coming! Look! We've got a big one on our hands!"
Leon,Male,Little busy at the moment!
Luis,Male,"Hey, our guests will think we're rude! So much for service with a smile, huh! But I guess bullets work just as well."
Leon,Male,Stay focused!
Leon,Male,None left!
Ashley,Female,"Leon! This way, hurry!"
Leon,Male,Ashley!?
Ashley,Female,Wh-What's happening to me?
Luis,Male,Ashley. Is this the first time you've coughed up blood like this?
Leon,Male,You wanna start explaining?
Luis,Male,"The cough, the blood—it's caused by something called a… plaga. (plague, pest, infestation) OK. You saw those people, right? Well, you have the same thing inside you. The same thing that made them like that. This, what you're experiencing, these symptoms… They're only the beginning."
Ashley,Female,I don't want to become like them.
Luis,Male,"You are, well, lucky. You see, at this early stage, the parasite—the plaga. It is possible to remove it… with a surgical procedure. And all you need is some know-how. And, oh yeah—the right equipment."
Leon,Male,"Wait. You, too?"
Luis,Male,"No worries. See, I have a plan. But you're going to have to trust me."
Luis,Male,Great! We're partners then!
Leon,Male,"Hey, why are you—"
Luis,Male,No time for any questions. The clock is ticking!
Leon,Male,Why are you helping us?
Luis,Male,Because it makes me feel better. Let's leave it at that. I will contact you later.
Luis,Male,Hey. Got a smoke?
Ada,Female,I do. The kind you like. Now where's the Amber?
Luis,Male,"Unfortunately, it's not on me at the moment. And you really should be telling me what a good job I did."
Luis,Male,Busted my ass and managed to hide it right before I got caught. Which is why I'm still alive!
Ada,Female,"The deal was we get you out of here when you deliver the Amber. No Amber? No protection, Luis."
Luis,Male,"Such a stickler for details, huh Ada? OK, then. I'll go get it now. How about that?"
Luis,Male,And I do have something else I need to get too.
Leon,Male,"This is Roost. I've got some bad news, Condor One."
Hunnigan,Female,"With the weather like this, the chopper can't make its approach. Can you stand by until it clears?"
Leon,Male,Negative. Too dangerous. We're gonna get out of here and find someplace safe.
Hunnigan,Female,"I'm sorry, I wish I could do more to help."
Leon,Male,Don't worry about it. We'll swim home if we have to. Condor One out.
Leon,Male,Let's go.
Ashley,Female,What's... What's gonna happen to me?
Leon,Male,"Right now, let's just focus on getting out of here."
Ashley,Female,Yeah. Right.
Leon,Male,"We've got company. Keep moving, but quietly. Got it?"
Ashley,Female,OK… I’ll… I’ll try…
Leon,Male,All right.
Ashley,Female,Leon!
Leon,Male,Guess we're doing this!
Leon,Male,Sure is quiet.
Leon,Male,Looks like I need something. All right. Won't open...
Leon,Male,Stay here.
Ashley,Female,What!?
Ashley,Female,O-OK.
Leon,Male,Great.
Leon,Male,"Sorry, didn't realize that was yours."
Leon,Male,"I am flattered, but I'm a one-lady type of guy."
Leon,Male,They keep coming! One down.
Ashley,Female,"Leon! Leon, help!"
Leon,Male,Hey!
Leon,Male,You hurt? Hang in there!
Ashley,Female,"No, I'm OK."
Leon,Male,Come on!
Ashley,Female,All right.
Leon,Male,"Stay down, all right?"
Ashley,Female,Holy...
Leon,Male,Here you go!
Leon,Male,Are you hurt?
Ashley,Female,"No, I'm... I'm OK, I guess."
Leon,Male,You did well back there. Seems this isn't your first time running from creeps.
Ashley,Female,I can't tell if that's meant to be a compliment.
Leon,Male,All right. Come on.
Ashley,Female,OK.
Leon,Male,Ashley!
Ashley,Female,Leon!
Old Man,Male,Your soul requires cleansing.
Old Man,Male,"Come, child."
Leon,Male,"Ashley, run! Hurry!"
Ashley,Female,Nooo!
Old Man,Male,There is no escape.
Ashley,Female,Leon!
Leon,Male,Don't worry about them! One down. The bridge!
Ashley,Female,Leon! Watch out!
Leon,Male,This way!
Leon,Male,You OK?
Ashley,Female,I'm stuck!
Leon,Male,We need to go!
Leon,Male,You gotta be kidding me.
Ashley,Female,I'm good!
Leon,Male,Then run!
Leon,Male,Close one.
Ashley,Female,Yeah.
Leon,Male,"Listen. You're the one he wants. If we see him again, you run."
Ashley,Female,Wh-What about you?
Leon,Male,I'll do my job.
Ashley,Female,Be careful.
Ashley,Female,Leon!
Old Man,Male,Cease your pointless struggling. Abandon your body to the will of our God.
Leon,Male,"You're a shitty missionary, you know that?"
Old Man,Male,"Oh, Almighty! Grant me the strength to crush your enemies."
Leon,Male,"Son of a bitch! Ashley, run!"
Ashley,Female,OK!
Leon,Male,Hasta luego! (Goodbye!)
Old Man,Male,"God, thank you for our gift!"
Leon,Male,You wanna get ugly? Let's get ugly!
Leon,Male,That had to have done something.
Leon,Male,Guess your tapdancing days are over!
Leon,Male,Back at you!
Leon,Male,Hey! Watch where you're swinging those things!
Leon,Male,"Running out of options, huh?"
Ashley,Female,Leon!
Ashley,Female,"Leon, quick! This place is coming down!"
Leon,Male,Give my regards to your god.
Ashley,Female,"Hey! You coming? Leon! Hey, come on! It's dangerous! Leon, hurry!"
Ashley,Female,You're welcome?
Leon,Male,Thanks. This fire's bound to catch their attention. Let's keep moving.
Ashley,Female,"Uh, Leon? I'm not going to turn into one of them, right?"
Leon,Male,I won't let that happen. I promise.
Ashley,Female,What's going on?
Leon,Male,"Well, at least we don't have to worry about being followed. Come on."
Luis,Male,Hola. Luis here. You guys still around?
Leon,Male,"Well, I wanted to go home, but Ashley just had to see this castle first."
Luis,Male,"Perfect, because I have a present I want to give you. Medicine that will help to suppress the progress of your...problem."
Leon,Male,Where do we go?
Luis,Male,Let's see... Come to the courtyard inside of the castle. We can meet up there. ¡Ciao!
Leon,Male,"All right, Ashley. Luis just said—"
Ashley,Female,I got it. Guess we better get going?
Merchant,,"Got some new wares, stranger. You're in for a treat. Welcome! I've got something new for you, mate. All my wares are in tip-top shape, I assure you. Rubies or rubbish, it makes no difference. The price, well, that's our choice to make. A deal well struck, heheh! Come back anytime. Got a selection of good things on sale, stranger! Heheheheh, thank you. Don't get yourself killed now, haha. Got a selection of good things on sale, stranger! Thank you! I see you have an eye for things. Gun's not just about shootin'. It's about reloadin'. You'll know what I'm talkin' about. Come back anytime. Thank you! Let us know when you've made some room. That cash in your pocket or your life? Easy choice, mate. This gun turns heads into pumpkins, mate. Take this for a rampage through the patch, heheh! Come back anytime. Heheheheh, thank you. That's an exemplary firearm right there, stranger. Not the best, sure, but she'll make you an ideal companion. See how that feels, mate. Fella like yourself should notice the difference right away. We're starting to get an idea of your tastes, friend. I don't always have this in stock, stranger. Pleasant travels."
Leon,Male,"Huh. Courtyard's gotta be through that gate. Don't think our hosts are gonna roll out the red carpet. What is that? Guessing it's not for decoration.... Crossbows, huh. Something tells me they don't want to be friends. Things just keep getting better."
Ashley,Female,What're they—
Leon,Male,Shh. Keep your voice down.
Leon,Male,Give me a break already.
Ashley,Female,No way! They have catapults!?
Leon,Male,I guess this is their idea of a warm welcome! You OK?
Ashley,Female,Yeah.
Leon,Male,They keep coming! You hurt?
Ashley,Female,"No, I'm OK."
Leon,Male,Shit! You're serious? Ashley! You all right?
Ashley,Female,"Yeah, I'm fine."
Leon,Male,Stay back!
Leon,Male,Firing again! Come on!
Ashley,Female,You got it!
Leon,Male,All right. That went well.
Ashley,Female,A little warning next time!
Ashley,Female,"Wow, look at this place. I mean, it's old but..."
Merchant,,"So that's a request, done and dusted, eh? Good stuff, mate. Heheheh, I knew I could count on you. Got a selection of good things on sale, stranger! My back is killin' me. Years haven't been kind to us, I suppose. Your valuables won't do you much good in the grave. Thank you! Easy work. This kind of work is about finesse, stranger. Little bit goes a long way. You'll see… Don't get yourself killed now, haha."
Salazar,Male,"A most warm welcome to my castle. Such a pleasure to finally make your acquaintance, Mr. Kennedy."
Leon,Male,Who—the hell—are you?
Salazar,Male,"Me? Oh please, call me Ramón. And allow me to get straight to the point. I would like you to hand the girl there, over to me...now."
Leon,Male,"Yeah, fat chance, Ramón. The girl's just fine. With me."
Ashley,Female,Never!
Leon,Male,You heard the lady.
Leon,Male,Just stay close.
Ashley,Female,Watch out! You OK?
Leon,Male,"Yeah, no sweat."
Leon,Male,"Ah, it's locked."
Leon,Male,Over here.
