Character,Gender,Playable,Line
Ashley,Female,Non-Playable,Where are you going!? Don't leave me!
Merchant,,Non-Playable,"Nothing but the finest wares! Your valuables won't do you much good in the grave. Heheheheh, thank you. There's some things money can't buy. Crossin' your T's, dottin' your I's. That's the way to be. We're starting to get an idea of your tastes, friend. Try that on for size. Anything else I can 'elp you with? Lightweight and easy to handle, this weapon has a lot of power."
Ashley,Female,Non-Playable,"Leon, look! Is that-?"
Leon,Male,Playable,Ada!
Leon,Male,Playable,He thinks he's going to lure me out. Stay here. I won't be long.
Ashley,Female,Non-Playable,Okay.
Leon,Male,Playable,Ada!
Leon,Male,Playable,Saddler!
Saddler,Male,Non-Playable,You foul renegade! You have forsaken the Holy Body… the great gift...to become one with us. You require ABSOLUTION!
Saddler,Male,Non-Playable,"Such blasphemous desecration! Such unforgivable heresy! Yet, is it not the sinner who is in most need of salvation?"
Leon,Male,Playable,I'm getting sick of your shit!
Leon,Male,Playable,"Finally a look that suits you, Saddler. A monster in and out. Still, I need to cut this date short. It's not me, it's you."
Ada,Female,Playable,Use this!
Leon,Male,Playable,I'll give you a holy body!
Leon,Male,Playable,Ada. What the hell are you doing?
Ada,Female,Playable,"Nothing personal, Leon. Luis and I had an arrangement. Don't worry, I'll take good care of it."
Ada,Female,Playable,Ride's here. You coming?
Leon,Male,Playable,I think we both know this is where we go our separate ways.
Ada,Female,Playable,I see.
Ada,Female,Playable,Better get a move on.
Leon,Male,Playable,Cute.
Ada,Female,Playable,"Until next time, Leon."
Ashley,Female,Non-Playable,Leon! Where's she going?
Leon,Male,Playable,Who knows.
Ashley,Female,Non-Playable,I don't understand. Why would she just—?
Leon,Male,Playable,Better move. Island's gonna blow.
Ashley,Female,Non-Playable,It's gonna WHAT!?
Leon,Male,Playable,Yeah.
Leon,Male,Playable,"OK, let's get out of here!"
Ashley,Female,Non-Playable,Yeah! Now we can go home!
Leon,Male,Playable,We're not outta here yet.
Ashley,Female,Non-Playable,Thanks.
Ashley,Female,Non-Playable,They're not attacking. What's going on?
Leon,Male,Playable,They're nothing now their master's gone. It's over for them.
Leon,Male,Playable,You like thrill rides?
Ashley,Female,Non-Playable,I love them!
Leon,Male,Playable,You're gonna love this!
Leon,Male,Playable,Hold on!
Leon,Male,Playable,You all right?
Ashley,Female,Non-Playable,I'm not sure! That was insane!
Ashley,Female,Non-Playable,"Mission accomplished, right?"
Leon,Male,Playable,Mission accomplished...when you're home safe.
Ashley,Female,Non-Playable,Thank you for saving me.
Leon,Male,Playable,Don't mention it.
Ashley,Female,Non-Playable,"You know, I could put in a word with my dad. Have you assigned to my detail, if you're interested?"
Leon,Male,Playable,"You don't need me. You proved you can handle yourself. Even if you could use a lesson in knife safety. Come on, let's go home."
Hunnigan,Female,Non-Playable,Condor One? Roost to Condor One! Do you read me? Come in! I said come in! Is this thing even on? Leon! Leon! Are you and Ashley all right? Where are you? Come on!
Ada,Female,Playable,Patch me through.
Ada,Female,Playable,I've obtained the Amber.
Wesker,Male,Non-Playable,Excellent.
Ada,Female,Playable,Just one question. What are you planning to do with this?
Wesker,Male,Non-Playable,I do not pay you to ask questions. All you need to know is a new dawn is breaking. A hundred will give their lives so that just one may live. I am expediting that change.
Ada,Female,Playable,"So, we're talking millions of casualties."
Wesker,Male,Non-Playable,Billions.
Ada,Female,Playable,How ambitious.
Ada,Female,Playable,We're changing course. Now.
