Character,Gender,Line
Merchant,,"Oh... Break's over, I suppose! Bigger is better, as they say. Least, I thought so when I was a lad...heheh. Crossin' your T's, dottin' your I's. That's the way to be. This kind of work is about finesse, stranger. Little bit goes a long way. You'll see… Pleasant travels."
Leon,Male,Christ... What kind of experiments are they doing here?
Leon,Male,...The fuck are you?
Leon,Male,Present for you.
Leon,Male,C'mon!
Leon,Male,Shit! Again!?
Leon,Male,Ashley!
Leon,Male,Shit.
Leon,Male,You're gonna be OK.
Ashley,Female,Leon?
Leon,Male,Sorry I'm late.
Ashley,Female,No. Thank you. You brought the medicine just in time.
Leon,Male,Can you stand?
Ashley,Female,Where's Luis?
Leon,Male,He was worried about you...until the end.
Leon,Male,Come on. We don't have much time. Let's get rid of these things.
Ashley,Female,For Luis.
Leon,Male,"Ada, come in. There's a lab where we can remove the parasites. Had a crazy hunch that you'd know where it is."
Ada,Female,Their most important facilities are housed in their sanctuary at the top of the mountain. That's where I'd look.
Leon,Male,Huh. Ada the encyclopedia.
Ada,Female,Happy to help. Now you owe me.
Leon,Male,You got it?
Ashley,Female,"Pfft, duh!"
Leon,Male,I'm counting on ya.
Ashley,Female,I'm pretty much a master of unlocking!
Merchant,,"Got some new wares, stranger. You're in for a treat. Welcome! Got something new for ya. Easy work. Good luck to you, stranger. Come back anytime. Your valuables won't do you much good in the grave..Heheheheh, thank you. This kind of work is about finesse, stranger. Little bit goes a long way. You'll see…"
Ashley,Female,Let's find another way.
Leon,Male,Ashley! You OK?
Ashley,Female,Yeah.
Ashley,Female,Watch out!
Ashley,Female,Awesome!
Ashley,Female,Be careful.
Ashley,Female,Give me a warning next time!
Leon,Male,You're serious?
Leon,Male,"Here, hold this down."
Ashley,Female,'K.
Leon,Male,Ashley!
Ashley,Female,Get off me!
Leon,Male,Hey!
Ashley,Female,Thanks.
Leon,Male,Anytime.
Leon,Male,Smells pretty bad. You OK?
Ashley,Female,"Yeah. Before, this would have killed me, though."
Leon,Male,"We go at the same time, yeah?"
Ashley,Female,Got it!
Leon,Male,OK. We go at the same time.
Ashley,Female,"Yeah, OK. Yeah!"
Leon,Male,Wait here.
Ashley,Female,No prob.
Leon,Male,What the fuck!?
Leon,Male,"Die, you stubborn son of a bitch!"
Leon,Male,Jesus. Cuddly bastard.
Ashley,Female,"You're not hurt, are you?"
Leon,Male,"No, I'm good. Get that lever."
Ashley,Female,OK.
Leon,Male,No power.
Leon,Male,Get this for me!
Ashley,Female,Leave it to me! I'm actually pretty good at this stuff.
Leon,Male,Ashley! Damn it!
Ashley,Female,Get real! Jerk! Over here!
Leon,Male,Shit!
Ashley,Female,Get off me!
Leon,Male,"Ashley, are you all right?"
Ashley,Female,"Yeah, thanks."
Leon,Male,Thanks.
Ashley,Female,You're welcome.
Merchant,,"So that's a request, done and dusted, eh? Good stuff, mate. Well look at you, mate! Oh, what're ya buyin'? So, which weapon will you be givin' a shine to? Give us a shout when you want to tune it up. Well then. What can I do you for? I'll buy almost anything. Ah... I'll buy it at a high price. You'll get some bang for your buck, I guarantee it. Stocking up while you can? Wise choice. I don't always have this in stock, stranger. Good as new. Easy work. Where you gonna put this, your pocket!?.Honestly, this might be the only gun you need… Hard times, mate… Nice catch."
Ashley,Female,Leon! Look.
Leon,Male,That the lift?
Ashley,Female,If we could do something about this wall…
Leon,Male,A wrecking ball.
Ashley,Female,I got this!
Leon,Male,Hey! You're serious?
Leon,Male,Is this what they teach kids in school these days?
Ashley,Female,Have you never heard of driver's ed? Get back!
Ashley,Female,Leon!
Leon,Male,Leave our friends to me!
Ashley,Female,Leon! Here we go! It's gonna take more than that. One more time! Take this! Come on! Break you freaking wall! Here we go! The hole's getting bigger! Almost there!
Leon,Male,"If you all want a beating that bad, I'm happy to oblige. Outta the way!"
Ashley,Female,Yeah! That did it! Did you see me? That was awesome!
Leon,Male,I think you might have found your calling.
Ashley,Female,"You know, I... I was thinking—we work well together, don't we?"
Leon,Male,I guess so.
Ashley,Female,"Right!? Maybe someday, I'll become an agent like you? What do you think? We could protect the US from any and all threats!"
Leon,Male,"Is that right? Well, either way, first we have to make it out of here."
Ashley,Female,"Hm, you're no fun."
Leon,Male,This must be what Luis was talking about.
Saddler,Male,"Prostrate yourselves! This is our Holy Body. Our divine providence! And soon… such a profound blessing for all...las plagas! Welcome, my children. I am Osmund Saddler. The speaker for our Lord."
Leon,Male,Tell someone who gives a shit.
Saddler,Male,Foolish lambs. Why do you deny grace?
Saddler,Male,"Now, abandon your body! Obey. Obey the voice of our Lord."
Ashley,Female,No… no! Stop! No!
Saddler,Male,"Sweet child, do not resist!"
Saddler,Male,"Pray, forgive these wicked sinners. My faithful disciple shall deliver to you your...penance. Now child, you need not be afraid. Submit your body and release yourself from fear!"
Leon,Male,"Saddler, you bastard!"
Krauser,Male,"(recorded) You've done well to make it this far, rookie. I've prepared a battlefield up ahead, just for us soldiers. Watered by the blood of generations, hundreds of years, the perfect place to put an end to what happened two years ago."
Merchant,,"Nothing but the finest wares! Welcome! Oh, what're ya buyin'? I'll buy almost anything. Stranger! Oooh, I'll pay a pretty penny for that. What can I interest you in? Let us know when you've made some room. Not my place to say, really, but sometimes things are more interesting if you keep a level playing field, don't you find? Pleasant travels. Easy work. Good as new. See how that feels, mate. Fella like yourself should notice the difference right away. Anything else I can 'elp you with? Come back anytime."
Krauser,Male,"I've been waiting for you, rookie. Oh, worried about the girl, is that it? Hmm, that's just like you. You always had poor judgment. But if you think I'm going to let you out of here alive… you're even more naive than I thought. You can't save her. You can't save anyone!"
Leon,Male,"Give it up, Krauser! Being a lackey for these maniacs… won't bring your men back. And what the hell for? Revenge on the government? You think they would want that?"
Krauser,Male,Revenge? You think I'm doing all this… for revenge?
Leon,Male,Isn't that what this is all about?
Krauser,Male,"You see, in that jungle, I had a revelation. The most important thing in this world is pure, unadulterated power! Los Iluminados have given me that."
Leon,Male,"You know, you were always an asshole. But at least you had some kind of code, some honor! And look at you now."
Krauser,Male,"Enough reminiscing. Move out and draw fire, soldier."
Krauser,Male,"Better run, rookie!"
Leon,Male,Not like I have a choice.
Krauser,Male,What's wrong? Show no mercy! Where's your instinct!? You're slow. And so goddamn weak. Guess I'll make the first move! Way too slow! I don't remember teaching you to move like that.
Leon,Male,But you did teach me never to match the enemy's pace.
Krauser,Male,"Don't stop moving, soldier! You better hustle. Who knows what's become of the girl."
Krauser,Male,You remember the fight in the jungle? We barely made it out alive.
Leon,Male,Go with your gut! Don't think! That was the first thing you taught me. He's turned this place into one big trap. I can't fight him on his terms.
Krauser,Male,"Ready to die, rookie? I'm no stranger to covert tactics, remember?"
Leon,Male,How could I forget! Shit!
Krauser,Male,"I love a good hunt! Still alive, huh? You got lucky! I admit—you've done well to stay alive this long."
Leon,Male,I'd be dead if I kept listening to people like you!
Krauser,Male,The reaper comes for cowards and the careless alike. Which are you?
Leon,Male,"I dunno. Guess I'll ask when I see him. Well, you've really gone all out for me. You shouldn't have!"
Krauser,Male,"You've passed with flying colors. Here's your medal! This is it, soldier!"
Leon,Male,You're really doing this? It's not too late!
Krauser,Male,"You and me are two sides of the same coin. I guess that means we'll never see eye to eye. You've made it all this way, but you haven't learned a thing! I have to say, I'm disappointed."
Krauser,Male,"From you, I take that as a compliment."
Krauser,Male,You and I have chosen different paths. All that's left now is to settle this the old-fashioned way.
Leon,Male,"I was thinking the same thing, Krauser. Let's finish this, Krauser."
Krauser,Male,Shut your mouth! You wouldn't want to die with it open! You can't beat me!
Leon,Male,"Are we done here, Krauser? I told you again and again… You're too soft to do what's necessary."
Krauser,Male,"That's the difference between you and me, rookie."
Krauser,Male,Time to finish… your training.
Krauser,Male,Witness the power!
Leon,Male,"You've lost it completely, Krauser."
Krauser,Male,Here I come!
Leon,Male,"So that's your true power? Oh, I'd ask for a refund."
Krauser,Male,You're gonna regret that smart mouth of yours. You're not getting away! I can't wait to see you writhe!
Leon,Male,Shit!
Krauser,Male,Training's not done. Last lesson starts right now.
Leon,Male,Nah. Time for the teacher to be taught.
Leon,Male,"Such confidence. Bring it, rookie!"
Krauser,Male,"Are you ready, rookie?"
Leon,Male,Yeah. Let's settle this.
Krauser,Male,"I'm not surprised you made it this far! Not bad, but I didn't expect anything less. After all, I know your potential better than anyone. It's a damn shame you can't see the truth. How long do you plan to fight in that primitive body of yours?"
Leon,Male,Until the mission's finished. You'd have said the same once.
Krauser,Male,You need to stop living in the past. Give up! My strength is without equal! Strength is everything. The weak can protect nothing!
Leon,Male,"The way you're going, there won't be anything left to protect! You'd have known that once!"
Krauser,Male,That's where you're wrong! I didn't know a damn thing! Now I do! You can't deny this power! Imagine the strength you'd have!
Leon,Male,And turn into a freak like you? You gotta be out of your mind!
Krauser,Male,"Always trying to get the last word. Come here, I'll beat that out of you. Hahaha... Yes! This is the moment I've been waiting for!"
Krauser,Male,Do...what you have to do.
Krauser,Male,That's right.
Krauser,Male,I trained you well… Leon.
Leon,Male,"That you did, Major. That you did."
Leon,Male,Their defenses are no joke. That's gotta be their sanctuary. Ashley!
Merchant,,"Oh... Break's over, I suppose! Welcome! Oh, what're ya buyin'? Rubies or rubbish, it makes no difference. The price, well, that's our choice to make. Heheheheh, thank you. Don't get yourself killed now, haha. Knife needs care every once in a while. Could be the difference between life and death. See how that feels, mate. Fella like yourself should notice the difference right away. Easy work. There you are, as you wished."
Leon,Male,What was that!?
Loudspeaker,,"Sorry, bad traffic! One combat chopper, compliments of Hunnigan! Call me Mike. Now let's show these assholes what we got!"
Leon,Male,Hunnigan... I owe you one.
Mike,Male,"Oh yeah, more customers! Lure them into an open area! I'll give them what they came for!"
Leon,Male,Damn it! They keep coming!
Mike,Male,"Jackpot! All right, go go go! Leave the area up ahead to me! Take break...before you join in on the fun! Hell yeah! What can I say, I never miss!"
Leon,Male,Huh! Not bad at all!
Mike,Male,"Twisty son of a bitch. Oh shit, an AA gun! That's gonna be a problem. Hey, tough guy, do something about that turret! I needed to take a piss anyway."
Leon,Male,Better give him what he wants.
Mike,Male,"Hurry up and do something about that gun, would ya!"
Leon,Male,Give me a break already.
Leon,Male,Time for a taste of your own medicine.
Leon,Male,Mike! All clear!
Mike,Male,"Thanks, buddy! All right, now watch me do my thing! Gate's open! Go get rowdy! Bad news—I'm out of ammo! You'll have to handle this one on your own! Don't worry, you got this! I bet you won't even break a sweat!"
Leon,Male,All right.
Mike,Male,Get in!
Leon,Male,Thanks!
Mike,Male,"When we get out of here, drinks are on me. I know a good bar."
Mike,Male,"Yeah, keep your head down! Nice and slow. What the—!?"
Leon,Male,No...Mike!
Leon,Male,Saddler!
Leon,Male,"I'll make sure you're the next to go, Saddler. They keep coming!"
Leon,Male,What the…
Merchant,,"Nothing but the finest wares! Welcome! What can I interest you in? Better to be overprepared, am I right? Pleasant travels."
Leon,Male,"Almost there... Ashley, I'm coming."
Leon,Male,Ashley!
Saddler,Male,"You have come, my child."
Leon,Male,What...do you want?
Saddler,Male,"I simply wish to share this gift with as many as possible. A humble wish, don't you think? You see, we are all connected through the Holy Body. And now your flesh and bones, your very thoughts… are already one with us."
Leon,Male,Bullshit.
Saddler,Male,Why do you reject serenity? When you need only accept the sacred gift? Like...she did.
Leon,Male,Saddler!
Saddler,Male,"Ah yes. The time has come… for this lamb to join our covenant! Oh, blessings unto him and the sweet mercy they bring. Exult all—and let it be so!"
Ada,Female,Leon! Go!
Leon,Male,Ashley... Ashley? Damn it.
Leon,Male,Laboratory B... Looks like it's this way.
Leon,Male,The hell?
Leon,Male,Fuck. I'm losing it.
Saddler,Male,"(via telepathy) Still you resist, child."
Leon,Male,Shut up!
Leon,Male,Enough! God damn it.
Leon,Male,This time… it has to be different.
Ashley,Female,You go first.
Leon,Male,"No way. Like I told you, I'm gonna get you home safe. Here goes nothing."
Leon,Male,Ashley...? Ashley...?
Ashley,Female,I'm right here.
Ashley,Female,I thought you were gonna die.
Leon,Male,You did this?
Ashley,Female,Yeah. Yeah I did this. Can you stand?
Leon,Male,That a map?
Ashley,Female,"Yeah, I found it. I think it says we can get out if we go...this way. Hey, we're a team, right?"
Leon,Male,Keep this up? I'll be out of a job.
Ashley,Female,"So, all of this? Removing the parasites... This was Luis?"
Leon,Male,I'm surprised this thing even booted up.
Leon,Male,Someone had a field day looting the Umbrella labs…
Leon,Male,Sorry.
Ashley,Female,"Like I said, we're a team!"
Leon,Male,You're getting good at that.
Ashley,Female,Right?
Ashley,Female,You sure you're OK?
Leon,Male,Never been better.
Ashley,Female,Good.
Ashley,Female,Look at this place! That woman who helped us... do you think she's all right?
Leon,Male,"Oh, I'm sure she's fine. She's not the type to roll over that easy."
Ashley,Female,"Sounds like you know her well… Hey, wait! Leon!"
Ashley,Female,Where are you going!? Don't leave me!
Merchant,,"Nothing but the finest wares! Your valuables won't do you much good in the grave. Heheheheh, thank you. There's some things money can't buy. Crossin' your T's, dottin' your I's. That's the way to be. We're starting to get an idea of your tastes, friend. Try that on for size. Anything else I can 'elp you with? Lightweight and easy to handle, this weapon has a lot of power."
Ashley,Female,"Leon, look! Is that-?"
Leon,Male,Ada!
Leon,Male,He thinks he's going to lure me out. Stay here. I won't be long.
Ashley,Female,Okay.
Leon,Male,Ada!
Leon,Male,Saddler!
Saddler,Male,You foul renegade! You have forsaken the Holy Body… the great gift...to become one with us. You require ABSOLUTION!
Saddler,Male,"Such blasphemous desecration! Such unforgivable heresy! Yet, is it not the sinner who is in most need of salvation?"
Leon,Male,I'm getting sick of your shit!
Leon,Male,"Finally a look that suits you, Saddler. A monster in and out. Still, I need to cut this date short. It's not me, it's you."
Ada,Female,Use this!
Leon,Male,I'll give you a holy body!
Leon,Male,Ada. What the hell are you doing?
Ada,Female,"Nothing personal, Leon. Luis and I had an arrangement. Don't worry, I'll take good care of it."
Ada,Female,Ride's here. You coming?
Leon,Male,I think we both know this is where we go our separate ways.
Ada,Female,I see.
Ada,Female,Better get a move on.
Leon,Male,Cute.
Ada,Female,"Until next time, Leon."
Ashley,Female,Leon! Where's she going?
Leon,Male,Who knows.
Ashley,Female,I don't understand. Why would she just—?
Leon,Male,Better move. Island's gonna blow.
Ashley,Female,It's gonna WHAT!?
Leon,Male,Yeah.
Leon,Male,"OK, let's get out of here!"
Ashley,Female,Yeah! Now we can go home!
Leon,Male,We're not outta here yet.
Ashley,Female,Thanks.
Ashley,Female,They're not attacking. What's going on?
Leon,Male,They're nothing now their master's gone. It's over for them.
Leon,Male,You like thrill rides?
Ashley,Female,I love them!
Leon,Male,You're gonna love this!
Leon,Male,Hold on!
Leon,Male,You all right?
Ashley,Female,I'm not sure! That was insane!
Ashley,Female,"Mission accomplished, right?"
Leon,Male,Mission accomplished...when you're home safe.
Ashley,Female,Thank you for saving me.
Leon,Male,Don't mention it.
Ashley,Female,"You know, I could put in a word with my dad. Have you assigned to my detail, if you're interested?"
Leon,Male,"You don't need me. You proved you can handle yourself. Even if you could use a lesson in knife safety. Come on, let's go home."
Hunnigan,Female,Condor One? Roost to Condor One! Do you read me? Come in! I said come in! Is this thing even on? Leon! Leon! Are you and Ashley all right? Where are you? Come on!
Ada,Female,Patch me through.
Ada,Female,I've obtained the Amber.
Wesker,Male,Excellent.
Ada,Female,Just one question. What are you planning to do with this?
Wesker,Male,I do not pay you to ask questions. All you need to know is a new dawn is breaking. A hundred will give their lives so that just one may live. I am expediting that change.
Ada,Female,"So, we're talking millions of casualties."
Wesker,Male,Billions.
Ada,Female,How ambitious.
Ada,Female,We're changing course. Now.
