Character,Gender,Line
Ashley,Female,‘K.
Leon,Male,Be careful.
Ashley,Female,It's open.
Leon,Male,Looks like we can continue on this way.
Ashley,Female,Be careful.
Leon,Male,Poor bastard... That's no way to go.
Ashley,Female,Ah! What was that? Do they keep animals down here or something?
Leon,Male,It can't see me...
Leon,Male,Gotcha!
Ashley,Female,"Ah! Oh, it's you. What happened down there?"
Leon,Male,"Nothing. You were right about the animals, though. You OK?"
Ashley,Female,"I'm fine. Well, for now."
Ashley,Female,Wow... Look at all of this.
Leon,Male,Won't budge…
Ashley,Female,What's that used for?
Leon,Male,"Well, it's just a replica. Only a couple uses for it."
Ashley,Female,This artwork... Doesn't it look like it's telling some kind of story?
Ashley,Female,"Hang on, this is the same room as before, isn't it? Guess we just circled around."
Ashley,Female,"Leon, what're you doing!?"
Leon,Male,Don't even think about trying this yourself!
Ashley,Female,Me? As if!
Merchant,,"Gun rhymes with fun for a reason, stranger! Welcome! Well then. What can I do you for? Rubies or rubbish, it makes no difference. The price, well, that's our choice to make. Thank you! Give that the care it deserves, mate."
Ashley,Female,"Leon! Are you kidding me!? Jumping across chandeliers? Seriously, who does that?"
Leon,Male,"What're you, my mother?"
Leon,Male,Not this guy again.
Ashley,Female,Ugh!
Leon,Male,No good.
Ashley,Female,Be careful.
Ashley,Female,"Leon, they're here!"
Leon,Male,"Ah, the entertainment!"
Ashley,Female,Leon! Watch out!
Leon,Male,"Out of the way! Come on! Hang on. Not bad, right? Shit!"
Ashley,Female,Put me down!
Ashley,Female,You OK?
Leon,Male,Yeah.
Leon,Male,"Sorry, must've slipped."
Ashley,Female,Holy…
Leon,Male,This is gonna be bright!
Leon,Male,This should do the trick.
Leon,Male,Shit!
Ashley,Female,"All right, awesome!"
Leon,Male,We're not out of the woods yet.
Ashley,Female,A hidden platform?
Leon,Male,"A little over the top, don't you think?"
Leon,Male,Come on.
Ashley,Female,‘K.
Leon,Male,You gonna be OK?
Ashley,Female,Yeah. I-I got this!
Ashley,Female,Leon!
Leon,Male,I'll cover you! Don't stop!
Ashley,Female,All right.
Ashley,Female,All right! Now that one!
Leon,Male,Be careful!
Ashley,Female,"Leon, watch out!"
Ashley,Female,Leon!
Leon,Male,Hang on! I've got you!
Leon,Male,Huh! C'mon! Ashley!
Leon,Male,All right.
Ashley,Female,I did it!
Leon,Male,"OK, get back here!! Hurry up!"
Ashley,Female,OK!
Leon,Male,You hurt?
Ashley,Female,"I'm good, thanks."
Leon,Male,Over here.
Leon,Male,"Hey, you sure you're good?"
Ashley,Female,Y-Yeah...
Leon,Male,Looks like the right place.
Leon,Male,You OK?
Ashley,Female,I think so. Uh—
Leon,Male,Ashley!
Leon,Male,Wait!
Leon,Male,"Roost, come in! Things went to shit. We took refuge inside a castle, but I've just been separated from Baby Eagle."
Hunnigan,Female,Say---ding you.
Leon,Male,Roost? You're breaking up. Do you read me?
Hunnigan,Female,--dor One! -- in! ---chopper-
Leon,Male,Damn it. So much for that.
Merchant,,"Heheh. Having a rough day, stranger? Welcome! I've got something new for you, mate. Your valuables won't do you much good in the grave. Perfect. You're a real professional. Good stuff, stranger! Came into some other bits and bobs too, mate. There's some things money can't buy. Don't worry, I offer repair services as well. Better to be overprepared, am I right? Give that the care it deserves, mate."
Leon,Male,This is messed up.
Leon,Male,Is he doing this? Sorry to interrupt! The hell is happening!?
Ada,Female,"You can stop right there, Leon. Wouldn't make me use this, would you?"
Leon,Male,"Well after six years, that is one hell of a greeting… Ada."
Ada,Female,You don't seem surprised. Interesting...
Leon,Male,Try using knives next time. Better for close encounters.
Ada,Female,Not a bad move. Very smooth.
Leon,Male,So who are you working for this time?
Ada,Female,"Oh, Leon. You know I don't work and tell."
Ada,Female,Leave the girl. She's lost no matter what. You walk away now… and who knows? Maybe you'll live to meet me again. And then I might get you that greeting you were looking for.
Leon,Male,You think I'm gonna give up that easy?
Ada,Female,Right. How about we continue this discussion another time?
Leon,Male,Last person I thought I'd run into here...
Leon,Male,"That should do it. All right, need to find Ashley."
Leon,Male,"Oh, great..."
Leon,Male,Christ!
Merchant,,"Gun rhymes with fun for a reason, stranger! Your valuables won't do you much good in the grave. A deal well struck, heheh! Moldin' a weapon to suit your specific needs, oho! It's a thing of beauty, innit? Crossin' your T's, dottin' your I's. That's the way to be. Dazzled, are you? Our craftsmanship demands no less."
Leon,Male,She said meeting you once was enough.
Leon,Male,"Oh, you were expecting me. OK, I think I see how this works."
Leon,Male,Next?
Leon,Male,C'mon! Another one? You guys are really starting to become a giant pain in my ass.
Leon,Male,Outta the way!
Leon,Male,Yes! A cannon! Hope it works.
Leon,Male,"Get ready. Adios, you son of a bitch."
Leon,Male,"All right, open for traffic."
Leon,Male,Sorry. I've had my fill of you guys.
Leon,Male,(to himself) Ashley? Where are you?
Ashley,Female,Stay back! I might hurt you again. I'm so scared. When that happened… I wasn't myself anymore. I was something else.
Leon,Male,"Ashley, that must have been terrifying. I-I know."
Ashley,Female,You too?
Leon,Male,"It's OK to be afraid, you know. But you can't run. You got to keep moving forward. We will beat this. Together."
Ashley,Female,I don't know if I can.
Leon,Male,"You can. Just give me a heads-up before you stab me next time, OK?"
Ashley,Female,Leon… Thanks.
Leon,Male,"Luis, where are you?"
Luis,Male,"Sorry I, uh, I screwed up. Come to my rescue, Prince Charming."
Leon,Male,"I'll show you charming, pal!"
Luis,Male,C'mon. I'm in the ballroom past the courtyard. Don't be late to the dance!
Leon,Male,Can't believe that guy.
Ashley,Female,"He's in trouble. We can't just leave him, right?"
Ashley,Female,"Hey, look! The flag's been lowered!"
Ashley,Female,You let them out!
Leon,Male,Easier this way!
Leon,Male,"Here, hold this down."
Ashley,Female,"Don't leave me! Hey, wait! Leon!"
Ashley,Female,You OK?
Leon,Male,"Yeah, no sweat."
Leon,Male,Ashley.
Ashley,Female,No prob. Be careful!
Leon,Male,Now we can finally get out of this maze.
Ashley,Female,Leon! They're here!
Leon,Male,"Ashley, run!"
Ashley,Female,Stay away! Stop! Leon!
Leon,Male,Hold on! I'll take care of them! You hurt?
Ashley,Female,"I'm good, thanks."
Leon,Male,Ballroom must be this way.
Merchant,,"I've got some new items in stock, heheh. Come, take a look! Welcome! Got something new for ya. That there's pretty big. Enough to get the job done, surely. Thank you! Rubies or rubbish, it makes no difference. The price, well, that's our choice to make. Give that the care it deserves, mate. Good luck to you, stranger. Knife needs care every once in a while. Could be the difference between life and death. Try that on for size. Come back anytime."
Merchant,,"Congratulations! I've prepared a new game for you. I think you'll like this one! Begin! Show 'em what you got! Reload! You're an artist, mate! Don't just shoot everything! Outstanding! That was awesome! That's your lot! You have a knack for this, friend! Now a shotgun—that can cover a lot of area with just one shell. Talk about bang for your buck. Begin! Triple kill! Superb shot! Oh, beautiful! Hah, yeah! Three at once! Reload! No! Not that one! Incredible! Triple kill! It's a bullet bonanza! Fire everything you've got! Very good! Triple kill! That'll do it! I can't believe it. Superb job! Begin! Show 'em what you got! That's the stuff! Brilliant! Reload! You missed. That's not like you. And that's the game!"
Ashley,Female,"Nice one, Leon!"
Ashley,Female,Look. There's a statue up there.
Leon,Male,There's a symbol on the wall. Statue of some snakes...
Leon,Male,"Huh, a dining hall."
Ashley,Female,Eat? Here? No thanks...
Leon,Male,Ashley.
Ashley,Female,Leon!
Leon,Male,Looks like we figured it out.
Ashley,Female,"Hey, it fits."
Ashley,Female,Leon!
Leon,Male,We're sandwiched all right!
Leon,Male,I'm coming for ya!
Ashley,Female,Stop! Hey! Up on the balcony!
Leon,Male,Fuck... I don't feel so...
Leon,Male,They keep coming!
Ashley,Female,"Leon! Help! Hey, wait! Leon!"
Leon,Male,"All right, Ashley! Let's move!"
Ashley,Female,"Uh, OK!"
Leon,Male,"Ashley, are you all right?"
Ashley,Female,"Yeah, thanks."
Ashley,Female,"Looks like we're still missing a piece… Hey Leon, there's some armor. Bet you could use it like a bulletproof vest."
Leon,Male,Little old fashioned for my taste.
Ashley,Female,Too bad. I think you'd look pretty dashing.
Leon,Male,"Ashley, stay up there!"
Ashley,Female,OK! Be careful!
Ashley,Female,Leon! The armor!
Leon,Male,"C'mon, you can't be serious!"
Leon,Male,Hah!
Ashley,Female,Look! It stopped moving! I don't think they like the lantern fire!
Ashley,Female,Take this! Get away from Leon!
Leon,Male,"Go to hell, you rusty piece of shit!"
Ashley,Female,Hey! Are you OK!?
Leon,Male,"Yeah! Nighty-night, knights."
Ashley,Female,Leon!
Ashley,Female,"Thanks. You sure you're all right? You're not burned, are you?"
Leon,Male,"Nah, thanks for your help. That really did the trick."
Ashley,Female,Hehe.
Leon,Male,Ashley.
Ashley,Female,"You don't think they're gonna move, do you?"
Merchant,,"A job well done deserves payment in kind. Oh, what're ya buyin'? What's that? How have we procured these curiosities? Heheheh, you don't wanna know. Rubies or rubbish, it makes no difference. The price, well, that's our choice to make. Well, well, I can certainly do something with this. Good as new. Give that the care it deserves, mate. Hello, stranger. Nothing but the finest wares! Welcome! What can I interest you in? Next time buy somethin', ey?"
Ashley,Female,"Leon, the stairs!"
Leon,Male,Stay back!
Leon,Male,Run! Now!
Ashley,Female,"I won't run. Wait for me, Leon."
Ashley,Female,Don't scare me like that…
Ashley,Female,Is that a clock? It's broken.
Ashley,Female,A hidden staircase? Must lead to a secret room or something.
Ashley,Female,Keys...
Ashley,Female,No way. It... It stopped?
Ashley,Female,Which one is it!?
Ashley,Female,What now!?
Ashley,Female,Leon!
Leon,Male,Ashley? Are you OK!?
Ashley,Female,"Hang on, I'll figure something out!"
Ashley,Female,What's this slot for?
Ashley,Female,Maybe...
Ashley,Female,Yes!
Ashley,Female,I know I saw another clock like this one...
Ashley,Female,"It's all good, nice and slow…"
Ashley,Female,Get lost! Don't look back. Don't look back.
Ashley,Female,Come on. Come on!
Ashley,Female,"Oh, thank god. I am done with armor."
Ashley,Female,Didn't I just say I was done!?
Ashley,Female,This sucks!
Ashley,Female,The heck…
Leon,Male,"No, no... No, don't go out! Again!? I've had enough of this!"
Ashley,Female,"OK, be good knights and stay still..."
Ashley,Female,Almost there!
Ashley,Female,All right.
Ashley,Female,Leon!
Leon,Male,Ashley? Are you all right?
Leon,Male,"Yeah! Give me a sec, I'll get you out."
Ashley,Female,Hey! Try this!
Leon,Male,Can you make it down? I can catch you.
Ashley,Female,"Yeah, I think so."
Leon,Male,Ashley!
Leon,Male,Shit!
Ada,Female,Sorry. Nothing yet. But my little helper is creating quite the commotion. Everything will work out just fine.
Ada,Female,He's a good boy. Predictable.
Ada,Female,Leon. Changed your mind yet?
Leon,Male,Ada?
Ada,Female,"Assuming you haven't, I've got a tip for you. Seems like something big is about to go down in the throne room. Babysitting's tough, huh."
Leon,Male,Hey! Ada? Ada! ...Perfect. Same as ever...
Leon,Male,"All right, time to get medieval on your asses. C'mon! Present for you."
Leon,Male,"Yeah, that's right."
Merchant,,"Nice work! I've got something new for you, mate. What's that? How have we procured these curiosities? Heheheh, you don't wanna know, mate. Got something new for ya. Heheheheh, thank you. There you are, as you wished. A well-tuned weapon can make up for a lack of skill, friend. This kind of work is about finesse, stranger. Little bit goes a long way. You'll see… Ah... I'll buy it at a high price. Knife needs care every once in a while. Could be the difference between life and death. You'll be shooting off some nasty fireworks in quick succession with that! Try that on for size. See how that feels, mate. Fella like yourself should notice the difference right away."
Leon,Male,Fucking monsters…
Leon,Male,"They keep coming! Wow Ramón, you are really slacking on your pest control."
Leon,Male,Throne room... This the way?
Leon,Male,"Great, there's two of them."
Leon,Male,Gotcha!
Ashley,Female,Nooo! No!
Leon,Male,Ashley!
Ashley,Female,Leon! Stop! No! Don't come any closer!
Leon,Male,Are you hurt?
Ashley,Female,Watch out!
Ashley,Female,No! No! Please! Let me go!
Leon,Male,You sick—
Ashley,Female,Leon!
Leon,Male,"Hang in there, Ashley. I'm coming for you."
Leon,Male,"Gave up the ghost, huh?"
Leon,Male,Talk about sticking the landing.
Leon,Male,The hell—!?
Leon,Male,Give me a break.
Merchant,,"Gun rhymes with fun for a reason, stranger! A deal well struck, heheh! Come back anytime. Welcome! Oho! You'll cut through the crowd with that right there. Knife needs care every once in a while. Could be the difference between life and death. Dazzled, are you? Our craftsmanship demands no less."
Leon,Male,Fuck! Not good!
Leon,Male,These people are not right.
Leon,Male,Something wrong with the power?
Leon,Male,You're kidding me… You! You're Ramón's lapdog!
Leon,Male,Frozen's a good look for you.
Leon,Male,Outta the way! Eat this! C'mon!
Leon,Male,Looks like it's gonna take more than that.
Leon,Male,What's your move?
Leon,Male,I think you need to chill out!
Leon,Male,"How's that? Hits different, huh!"
Leon,Male,"So we're playing hide-and-seek, is that it?"
Leon,Male,You son of a bitch!
Leon,Male,"Finally, some peace and quiet. My condolences to your master."
Saddler,Male,"Pitiful little lamb. Your suffering can end. Just as it has for our newest daughter. Who has joined us in communion. And now, she is of our flesh.... of our blood. My faithful disciple will show her the path. Go now! Deliver to these vagrant children their salvation."
Luis,Male,I'll make it cheap for you.
Luis,Male,Feeling better?
Leon,Male,Yeah. Seems like it worked.
Leon,Male,Bad news?
Luis,Male,All we've done is buy you some time. The suppressant's effects will wear off all too soon.
Luis,Male,You ready to go?
Leon,Male,Don't worry about me. Ashley is the priority.
Luis,Male,"In that case, we know what we have to do. Then come, Sancho Panza!"
Luis,Male,Let us rescue the Princess Dulcinea!
Leon,Male,You're gonna hurt yourself!
Luis,Male,"Hey! That was my lance! OK, we hurry! I get it!"
Leon,Male,"Why help me, though? What's in it for you?"
Luis,Male,"No need to be suspicious! I said I'd help you, didn't I?"
Merchant,,"There you are! We got a new game for you, stranger. You're gonna take 'er for a spin, right? Targets don't just stick around forever, ey? Don't let the small fry distract you from the big fish! Begin!"
Luis,Male,That was dirty.
Merchant,,"Oh, beautiful! That's the stuff! Reload! You're an artist, mate! Heheheh! Let the bonus time begin! Bonus targets! Hard to turn that down! Brilliant! C'mon! And that's the game! Not every day I see a performance like that. You're something else, you are! Begin! Triple kill! That's it! You're an artist, mate!"
Luis,Male,Makin' it look easy!
Merchant,,"Sorry mate, that's a penalty. Reload!"
Luis,Male,"Oh, a double. Nice."
Merchant,,"Double kill! That's your lot! Some of the targets are, well, particularly sturdy. One shot won't be enough for those, I'd wager! Begin!"
Luis,Male,Don't go easy just because it's a game.
Merchant,,"Oh, beautiful!"
Luis,Male,A triple!? Look at this guy!
Merchant,,"Reload! You're an artist, mate! Double kill! That's it! Incredible! Very good! Double kill! And that's the game!"
Luis,Male,"Good work. Good shootin', cowboy. I had fun just watching you work."
Leon,Male,Little hard to put my faith in someone who used to work for Umbrella.
Luis,Male,"So you heard, huh? Umbrella's done for. You don't need to worry about them anymore."
Leon,Male,You didn't answer my question. What are you after?
Luis,Male,I just wanna feel good about myself. Make amends. Or something like that.
Luis,Male,Looks like we've got company. What do you wanna do?
Luis,Male,¡Cuidado! (Watch out!) The ones with chainsaws are no joke!
Leon,Male,"Believe me, I know!"
Luis,Male,"Not bad, right?"
Leon,Male,Huh! Outta the way! That was not easy.
Luis,Male,Time to shine!
Leon,Male,Aren't you full of surprises?
Luis,Male,Leave it to me!
Leon,Male,Not bad.
Luis,Male,You got this!
Leon,Male,Sure thing!
Leon,Male,I bet I could use this.
Luis,Male,"Dynamite, huh? Nice find, my friend."
Leon,Male,Yeah. Should make quick work of that dead end.
Luis,Male,¡Dios mío! Give me a heads-up next time!
Leon,Male,You handle yourself pretty well… You sure you're just a researcher?
Luis,Male,I'm just an average guy who happens to be quite the ladies' man.
Luis,Male,"After you, I insist."
Leon,Male,Such a gentleman.
Luis,Male,Hey!
Luis,Male,Now you owe me!
Leon,Male,Luis! Heads up!
Leon,Male,Now we're even.
Luis,Male,Is it always like this with you?
Luis,Male,Two of them. One for each of us! Leave this one to me!
Leon,Male,This other one's not gonna be easy.
Luis,Male,"Ugh! It moved! Sorry, keep our friend busy for me!"
Leon,Male,Where do you think you're going?
Luis,Male,Leon! Over here!
Luis,Male,What are you doing!? Hurry up!
Luis,Male,Delivery!
Leon,Male,"Heh! Got a little present, just for you!"
Luis,Male,"Leon, shoot it!"
Luis,Male,"Beautiful! Just as planned! All right, let's finish this guy off!"
Luis,Male,Perfect timing! ¡Oye! I think we can get through here!
Leon,Male,Come on.
Leon,Male,How's it look?
Luis,Male,There. It's open.
Luis,Male,"Well, that was a pain."
Leon,Male,"They're keeping those things cooped up down here, too?"
Luis,Male,"The underground here is sacred to them. See, this is where they discovered las plagas. Preserved inside ancient deposits of amber."
Leon,Male,Of course they did.
Luis,Male,You're not suggesting we ride this thing? Do you see any other way?
Luis,Male,"Give us a push, Sancho!"
Leon,Male,Who're you calling Sancho?
Luis,Male,"There, it's moving. This should speed things up a bit."
Leon,Male,I can't believe I'm doing this.
Luis,Male,"Hey, we're in a hurry, right? Oh, by the way…"
Leon,Male,What now?
Luis,Male,Hope you like thrill rides.
Luis,Male,"We're going off the rails! Lean! ¡Mierda! Do something about those boards! ¡Oye! Switch tracks! If we don't, we're gonna crash! We're going off the rails! Give me a hand!"
Luis,Male,It's them! Watch out! Up ahead! Shoot the boards!
Luis,Male,Finally some peace and quiet.
Luis,Male,Left turn! We're curving to the right!
Leon,Male,This it?
Luis,Male,Afraid not. Things are just getting started.
Leon,Male,Shit!
Luis,Male,"All right, let's go."
Leon,Male,Not this again…
Luis,Male,Hey! The cart's tipping over!
Leon,Male,We've got trouble.
Luis,Male,Haha! This is kind of fun! We're going off the rails! Give me a hand! Left turn! Shit! This thing's gonna flip!
Luis,Male,"Not looking so good. I hope the cart holds up… This thing's in bad shape. Take better care of it, OK?"
Leon,Male,"End of the line, asshole!"
Luis,Male,We're going off the rails! Give me a hand! Hey! The cart's tipping over! Look! You can see where they dug up the bugs! Ahead!
Leon,Male,You're kidding… Get the brake!
Leon,Male,What!? Are you serious!? Jump!
Luis,Male,¡Oye!
Leon,Male,Luis!
Luis,Male,"Can I get a hand? Give us a 3, 2, 1 next time, eh Sancho."
Leon,Male,Whatever.
Luis,Male,"Oh, man... Hm, but actually this works. Oye. Let's get on that lift."
Luis,Male,No way. Give me a break.
Leon,Male,We can make it if we circle around. Come on.
Luis,Male,Pain in my ass…
Luis,Male,Ah! I knew it! Stay sharp! These guys have camouflage!
Luis,Male,You got this!
Leon,Male,One down.
Luis,Male,It's all you!
Luis,Male,"I hate insects! Take care of them for me, would ya?"
Leon,Male,How about you open fire instead of your mouth!
Luis,Male,"Hey, I'm the brains. You're the brawn."
Merchant,,"Ah, I see you took care of a request. Well done. Thank you! Pleasant travels. A deal well struck, heheh! Good luck to you, stranger. That's good work if I do say so myself."
Luis,Male,Whew. I'm beat. Makes you appreciate tech like this.
Leon,Male,I don't get you. Why risk your life like this? You don't know us.
Luis,Male,I told you. It makes me feel better.
Leon,Male,Be straight with me for once.
Luis,Male,Los Iluminados... I was working for them.
Leon,Male,See? There you go.
Luis,Male,Helping the two of you.doesn't make up for it. I know that. But still...I don't want anyone else to get hurt.
Leon,Male,"In that case, you better get serious."
Luis,Male,Harsh words for a squire.
Luis,Male,"We're out of that hellhole! The fresh air is calling our names! Because if we made it all this way, you know it means we're almost—"
Leon,Male,Almost what?
Leon,Male,Luis!
Krauser,Male,"Long time no see, rookie."
Leon,Male,Major Krauser? What the hell? Why?
Krauser,Male,Recovering stolen goods.
Krauser,Male,And killing a few rats along the way. Easy work.
Leon,Male,Ashley... It was you.
Krauser,Male,You catch on quick. Didn't I teach you? Knives are faster.
Krauser,Male,Not bad.
Krauser,Male,"We are just getting started, rookie."
Leon,Male,Are you being controlled by that cult!?
Krauser,Male,This has nothing to do with them. I'm a free man who made a choice.
Leon,Male,Major! You're not thinking straight!
Krauser,Male,"Oh, my mind's clearer than it's ever been. Now focus and show me what you've got."
Leon,Male,A soldier like you? Why would you work for these freaks?
Krauser,Male,Why? Have you forgotten what happened two years ago?
Leon,Male,Operation Javier?
Krauser,Male,Haven't you learned anything these last two years? They killed us all. Without honor. Without mercy. Only devastating power! What's wrong with wanting the same for myself?
Leon,Male,Krauser! I can understand. What happened was...unforgivable. But that doesn't give you the right to hurt innocent people!
Krauser,Male,You're still a kid holding on to fantasies of what's right and wrong. Too slow! What's wrong? Not looking too steady.
Krauser,Male,"Enough play, rookie. You haven't changed a damn bit. What a disappointment."
Luis,Male,"Not looking good, eh, my friend? And such a loss to the ladies of the world."
Leon,Male,Don't talk.
Luis,Male,Take this. The key to my laboratory. Go there… and remove those damn… parasites… Help… Ashley…
Luis,Male,"You know, I led a pretty shitty life. But now, eh… ...what do you think, Leon? People can change, right?"
Leon,Male,"You were a fine knight, Don Quixote."
Leon,Male,"You won't get away with this, Krauser."
Ada,Female,"Leon. There's only time to say this once, so listen up. They took your friend to the top of the clock tower. If you hurry, you might get there before she turns into one of them."
Leon,Male,"Ah, so you aren't heartless after all. I guess I should be...thankful?"
Ada,Female,"Yeah, you should."
Leon,Male,"There's the clock tower. Hang in there, Ashley."
Leon,Male,You really know how to make someone feel welcome.
Leon,Male,A lift. How thoughtful.
Leon,Male,"You don't give up, do you?"
Leon,Male,What!? The lift!
Leon,Male,"Sorry! Lift's taken! All right. Shit, my body armor!"
Leon,Male,Ashley! That son of a bitch.
Merchant,,"You have the stench of battle on you, mate. Heheh. Welcome! Well then. What can I do you for? Stocking up while you can? Wise choice. A deal well struck, heheh! Good as new. Crossin' your T's, dottin' your I's. That's the way to be. There you are, as you wished. Will that be all, then? Don't get yourself killed now, haha. Nothing but the finest wares!"
Leon,Male,Ashley!
Ashley,Female,Leon!
Leon,Male,You talk too much.
Leon,Male,Leave me out of your crappy script.
Leon,Male,"Watch your language, my lord. What would others think of you?"
Leon,Male,I will send you back to the hell you came from!
Leon,Male,I'm gonna shut that mouth of yours for you.
Leon,Male,Ashley... No time to lose.
Leon,Male,Krauser… Where do you think you're taking her?
Leon,Male,Perfect. Won't have to swim after all.
Leon,Male,"Ah, damn it."
Ada,Female,Looking for something?
Ada,Female,You look like you've got something to say.
Leon,Male,"I've something to ask you… but I don't think I'll get a straight answer. Raccoon City. You know, after the incident. The world changed. You try to save one person; a hundred others die. I guess I changed too."
Ada,Female,You? Leon S. Kennedy? You haven't changed. You just think you have.
Leon,Male,"So here's my question… Have you changed, Ada? Or are you just trying to use me again?"
Ada,Female,What do you think? We're here.
Ada,Female,"Don't think too hard, handsome. See you later."
Leon,Male,Story of my life.
Leon,Male,Ashley. There you are. Spotlights... Let's avoid those. Look at all these busy bees. Better watch my step if I don't want to get stung.
Merchant,,"I've got some new items in stock, heheh. Come, take a look! Welcome! Got some rare things on sale, stranger. That cash in your pocket or your life? Easy choice, mate..Easy work. Heheheheh, thank you. Pleasant travels."
Leon,Male,Damn it!
Leon,Male,"Sorry, must've slipped. Not bad, right? Next? Outta the way! They keep coming! A rocket launcher!? This isn't good!"
Leon,Male,This where they're keeping Ashley?
Leon,Male,You're serious? Give me a break already. Doesn't look like I can get in through here. Need to find another way.
Leon,Male,"Ashley! Ashley! Come on, Ashley! Wake up! Shit!"
Leon,Male,Need a keycard.
